tweet_id,timestamp,source,text,name,dog_style,rating,favorite_count_x,retweet_count_x,retweet_count_y,favorite_count_y,followers_count
7.29855E+17,2016-05-10 02:05:03+00:00,"<a href=""http://twitter.com/download/iphone"" rel=""nofollow"">Twitter for iPhone</a>",Say hello to Ollie. He conducts this train. He also greets you as you enter. Kind af. 11/10 would pet so firmly https://t.co/jVxOGKEU0z,Ollie,,1.1,4241,1204,1204,4241,7418616
7.29824E+17,2016-05-10 00:01:12+00:00,"<a href=""http://twitter.com/download/iphone"" rel=""nofollow"">Twitter for iPhone</a>",This is Stefan. He's a downright remarkable pup. 13/10 https://t.co/Ebjt6Y4fMh,Stefan,,1.3,4191,1327,1327,4191,7418616
7.29464E+17,2016-05-09 00:11:16+00:00,"<a href=""http://twitter.com/download/iphone"" rel=""nofollow"">Twitter for iPhone</a>",Meet Pupcasso. You can't afford his art. 13/10 talented af https://t.co/f2VUpy4WO0,Pupcasso,,1.3,6110,2467,2467,6110,7418616
7.28986E+17,2016-05-07 16:34:32+00:00,"<a href=""http://twitter.com/download/iphone"" rel=""nofollow"">Twitter for iPhone</a>","This is Puff. He started out on the streets (first pic), but don't let the new smile fool you, still tough af. 11/10 https://t.co/kiuXRXcg4B",Puff,,1.1,3324,879,879,3324,7418616
7.28751E+17,2016-05-07 00:59:55+00:00,"<a href=""http://twitter.com/download/iphone"" rel=""nofollow"">Twitter for iPhone</a>",This is Flurpson. He can't believe it's not butter. 10/10 https://t.co/XD3ort1PsE,Flurpson,,1,2921,726,726,2921,7418616
7.28654E+17,2016-05-06 18:33:34+00:00,"<a href=""http://twitter.com/download/iphone"" rel=""nofollow"">Twitter for iPhone</a>",This is Coleman. Somebody needs to tell him that he's sitting in chairs wrong. 8/10 https://t.co/O10zjJ2Ixs,Coleman,,0.8,3481,1114,1114,3481,7418616
7.2841E+17,2016-05-06 02:24:02+00:00,"<a href=""http://twitter.com/download/iphone"" rel=""nofollow"">Twitter for iPhone</a>",This is Wallace. He's a skater pup. He said see ya later pup. Can easily do a kick flip. Gnarly af. 10/10 v petable https://t.co/5i8fORVKgr,Wallace,,1,5163,2147,2147,5163,7418616
7.28387E+17,2016-05-06 00:53:27+00:00,"<a href=""http://twitter.com/download/iphone"" rel=""nofollow"">Twitter for iPhone</a>","This is Enchilada (yes, that's her real name). She's a Low-Cruisin Plopflopple. Very rare. Only a few left. 12/10 https://t.co/SiaiTWgsfP",Enchilada,,1.2,3855,1024,1024,3855,7418616
7.28047E+17,2016-05-05 02:21:37+00:00,"<a href=""http://twitter.com/download/iphone"" rel=""nofollow"">Twitter for iPhone</a>",This is Raymond. He controls fountains with his tongue. 11/10 pretty damn magical https://t.co/9aMxSbOaAZ,Raymond,,1.1,4529,1259,1259,4529,7418616
7.28035E+17,2016-05-05 01:35:26+00:00,"<a href=""http://twitter.com/download/iphone"" rel=""nofollow"">Twitter for iPhone</a>",This is all I want in my life. 12/10 for super sleepy pupper https://t.co/4RlLA5ObMh,All,pupper,1.2,4777,1787,1787,4777,7418616
7.28016E+17,2016-05-05 00:16:48+00:00,"<a href=""http://twitter.com/download/iphone"" rel=""nofollow"">Twitter for iPhone</a>",This is Rueben. He has reached ultimate pupper zen state. 11/10 tranquil af https://t.co/Z167HgtnBi,Rueben,pupper,1.1,4308,1169,1169,4308,7418616
7.27686E+17,2016-05-04 02:26:00+00:00,"<a href=""http://twitter.com/download/iphone"" rel=""nofollow"">Twitter for iPhone</a>",This is Cilantro. She's a Fellation Gadzooks. Eyes are super magical af. 12/10 could get lost in https://t.co/yJ26LNuyj5,Cilantro,,1.2,3091,683,683,3091,7418616
7.27175E+17,2016-05-02 16:38:15+00:00,"<a href=""http://twitter.com/download/iphone"" rel=""nofollow"">Twitter for iPhone</a>",This is Karll. He just wants to go kayaking. 10/10 please someone take Karll kayaking already https://t.co/vXLkvyNQHp,Karll,,1,4067,1469,1469,4067,7418616
7.26935E+17,2016-05-02 00:43:25+00:00,"<a href=""http://twitter.com/download/iphone"" rel=""nofollow"">Twitter for iPhone</a>",This is Sprout. He's just precious af. 12/10 I'd do anything for Sprout https://t.co/DxlX1yTVYY,Sprout,,1.2,7231,2625,2625,7231,7418616
7.26887E+17,2016-05-01 21:32:40+00:00,"<a href=""http://twitter.com/download/iphone"" rel=""nofollow"">Twitter for iPhone</a>",This is Blitz. He's a new dad struggling to cope mentally with the pressures of being a father. Sick shades 10/10 https://t.co/2AVcJ2BZsy,Blitz,,1,4026,1609,1609,4026,7418616
7.26828E+17,2016-05-01 17:38:46+00:00,"<a href=""http://twitter.com/download/iphone"" rel=""nofollow"">Twitter for iPhone</a>",This is Bloop. He's a Phoenician Winnebago. Tongue is just wow. That box is all he has (tragic). 12/10 would caress https://t.co/DWNrPPXgHA,Bloop,,1.2,3729,1078,1078,3729,7418616
7.25842E+17,2016-04-29 00:21:01+00:00,"<a href=""http://twitter.com/download/iphone"" rel=""nofollow"">Twitter for iPhone</a>",This is Colby. He's currently regretting all those times he shook your hand for an extra treat. 12/10 https://t.co/vtVHtKFtBH,Colby,,1.2,7410,2833,2833,7410,7418616
7.25787E+17,2016-04-28 20:40:11+00:00,"<a href=""http://twitter.com/download/iphone"" rel=""nofollow"">Twitter for iPhone</a>",Say hello to Lillie. She's a Rutabagan Floofem. Poor pupper ate and then passed out. 11/10 relatable af https://t.co/uIdGqug9rw,Lillie,pupper,1.1,4372,1453,1453,4372,7418616
7.25729E+17,2016-04-28 16:52:08+00:00,"<a href=""http://twitter.com/download/iphone"" rel=""nofollow"">Twitter for iPhone</a>",This is Lola. She's a Butternut Splishnsplash. They are known to be ferocious af. 12/10 would absolutely still pet https://t.co/adQt5a6TZU,Lola,,1.2,5446,1901,1901,5446,7418616
7.24984E+17,2016-04-26 15:29:30+00:00,"<a href=""http://twitter.com/download/iphone"" rel=""nofollow"">Twitter for iPhone</a>",This is Fred-Rick. He dabbles in parkour. The elevation gives him power. 12/10 hopefully visiting a mailbox near you https://t.co/qFqLtudIiD,Fred,,1.2,3890,1391,1391,3890,7418616
7.24406E+17,2016-04-25 01:12:38+00:00,"<a href=""http://twitter.com/download/iphone"" rel=""nofollow"">Twitter for iPhone</a>",This is Ashleigh. She's having Coachella withdrawals. Didn't even go tho. 10/10 stay strong pupper https://t.co/nRUaKWnJfH,Ashleigh,pupper,1,5570,1761,1761,5570,7418616
7.2405E+17,2016-04-24 01:38:33+00:00,"<a href=""http://twitter.com/download/iphone"" rel=""nofollow"">Twitter for iPhone</a>",This is Kreggory. He just took a look at his student debt. 10/10 can't even comprehend it https://t.co/XTsZTgilnT,Kreggory,,1,4537,1889,1889,4537,7418616
7.24046E+17,2016-04-24 01:24:35+00:00,"<a href=""http://twitter.com/download/iphone"" rel=""nofollow"">Twitter for iPhone</a>","This is Sarge. Not even he knows what his tongue is doing, but it's pretty damn spectacular. 10/10 https://t.co/pIQEdbBxdL",Sarge,,1,2797,596,596,2797,7418617
7.24005E+17,2016-04-23 22:38:43+00:00,"<a href=""http://twitter.com/download/iphone"" rel=""nofollow"">Twitter for iPhone</a>",This is Luther. He saw a ghost. Spooked af. 11/10 hang in there pupper https://t.co/EdKG43VvEl,Luther,pupper,1.1,4395,1683,1683,4395,7418617
7.23913E+17,2016-04-23 16:34:28+00:00,"<a href=""http://twitter.com/download/iphone"" rel=""nofollow"">Twitter for iPhone</a>",This is Sugar. She's a Bolivian Superfloof. Spherical af. 12/10 would never let go of https://t.co/AhMfUu6Onm,Sugar,,1.2,4084,1307,1307,4084,7418618
7.23688E+17,2016-04-23 01:41:59+00:00,"<a href=""http://twitter.com/download/iphone"" rel=""nofollow"">Twitter for iPhone</a>",This is Reginald. He starts screaming at random. 12/10 cuddly af https://t.co/YgNuDQbv89,Reginald,,1.2,8097,3192,3192,8097,7418618
7.23673E+17,2016-04-23 00:41:42+00:00,"<a href=""http://twitter.com/download/iphone"" rel=""nofollow"">Twitter for iPhone</a>",This is Ivar. She is a badass Viking warrior. Will sack your village. 10/10 savage af https://t.co/Dz6MiVssVU,Ivar,,1,3176,954,954,3176,7418618
7.2318E+17,2016-04-21 16:00:57+00:00,"<a href=""http://twitter.com/download/iphone"" rel=""nofollow"">Twitter for iPhone</a>",This is Jangle. She's addicted to broccoli. It's the only thing she cares about. Tragic af. 8/10 get help pup https://t.co/8dNWp1cSEa,Jangle,,0.8,5564,2006,2006,5564,7418618
7.22613E+17,2016-04-20 02:30:23+00:00,"<a href=""http://twitter.com/download/iphone"" rel=""nofollow"">Twitter for iPhone</a>",Meet Schnitzel. He's a Tropicana Floofboop. Getting too big for his favorite basket. 12/10 just so damn fluffy https://t.co/qjd0UJKYUY,Schnitzel,,1.2,5205,1746,1746,5205,7418618
7.21503E+17,2016-04-17 00:58:53+00:00,"<a href=""http://twitter.com/download/iphone"" rel=""nofollow"">Twitter for iPhone</a>",This is Panda. He's happy af. 11/10 https://t.co/IOAk9i4UvE,Panda,,1.1,4888,2001,2001,4888,7418618
7.21001E+17,2016-04-15 15:44:11+00:00,"<a href=""http://twitter.com/download/iphone"" rel=""nofollow"">Twitter for iPhone</a>",This is Oliver. Bath time is upon him. His fear of the wetness postpones his ultimate pupper destiny. 11/10 https://t.co/AFzzKqR4tT,Oliver,pupper,1.1,2655,656,656,2655,7418618
7.20785E+17,2016-04-15 01:26:47+00:00,"<a href=""http://twitter.com/download/iphone"" rel=""nofollow"">Twitter for iPhone</a>",This is Archie. He hears everything you say. Doesn't matter where you are. 12/10 https://t.co/0l4I8famYp,Archie,,1.2,3270,825,825,3270,7418618
7.20775E+17,2016-04-15 00:46:48+00:00,"<a href=""http://twitter.com/download/iphone"" rel=""nofollow"">Twitter for iPhone</a>",This is Berkeley. He's in a predicament. 10/10 someone help him https://t.co/XSEXdQupej,Berkeley,,1,2600,724,724,2600,7418618
7.2039E+17,2016-04-13 23:15:21+00:00,"<a href=""http://twitter.com/download/iphone"" rel=""nofollow"">Twitter for iPhone</a>",This is RalphÃ©. He patrols the lake. Looking for babes. 11/10 https://t.co/Pb6iMmo0wk,RalphÃ©,,1.1,6727,2688,2688,6727,7418619
7.20341E+17,2016-04-13 19:59:42+00:00,"<a href=""http://twitter.com/download/iphone"" rel=""nofollow"">Twitter for iPhone</a>",This is Derek. He just got balled on. Can't even get up. Poor thing. 10/10 hang in there pupper https://t.co/BIRRF3bcWH,Derek,pupper,1,3013,1041,1041,3013,7418619
7.20059E+17,2016-04-13 01:22:10+00:00,"<a href=""http://twitter.com/download/iphone"" rel=""nofollow"">Twitter for iPhone</a>",This is Charleson. He lost his plunger. Looked everywhere. Can't find it. So sad. 9/10 would comfort https://t.co/pRHX8yn9Yu,Charleson,,0.9,4076,1205,1205,4076,7418619
7.20043E+17,2016-04-13 00:17:25+00:00,"<a href=""http://twitter.com/download/iphone"" rel=""nofollow"">Twitter for iPhone</a>",This is Neptune. He's a Snowy Swiss Mountain Floofapolis. Cheeky wink. Tongue nifty af. 11/10 would pet so firmly https://t.co/SoZq2Xoopv,Neptune,,1.1,5138,2146,2146,5138,7418619
7.19704E+17,2016-04-12 01:51:36+00:00,"<a href=""http://twitter.com/download/iphone"" rel=""nofollow"">Twitter for iPhone</a>",This is Clyde. He's making sure you're having a good train ride. 12/10 great pupper https://t.co/y206kWHAj0,Clyde,pupper,1.2,4795,1551,1551,4795,7418619
7.19551E+17,2016-04-11 15:43:12+00:00,"<a href=""http://twitter.com/download/iphone"" rel=""nofollow"">Twitter for iPhone</a>",This is Harnold. He accidentally opened the front facing camera. 10/10 get it together Harnold https://t.co/S6JHaSMtln,Harnold,,1,5304,2057,2057,5304,7418619
7.19368E+17,2016-04-11 03:33:34+00:00,"<a href=""http://twitter.com/download/iphone"" rel=""nofollow"">Twitter for iPhone</a>",Meet Sid &amp; Murphy. Murphy floats alongside Sid and whispers motivational quotes in his ear. Magical af. Both 11/10 https://t.co/7mmjyearQW,Sid,,1.1,2930,789,789,2930,7418619
7.19339E+17,2016-04-11 01:41:07+00:00,"<a href=""http://twitter.com/download/iphone"" rel=""nofollow"">Twitter for iPhone</a>",Say hello to Lucy and Sophie. They think they're the same size. Both 10/10 would snug at same time https://t.co/HW50zkcf2R,Lucy,,1,4637,1336,1336,4637,7418619
7.19333E+17,2016-04-11 01:13:34+00:00,"<a href=""http://twitter.com/download/iphone"" rel=""nofollow"">Twitter for iPhone</a>",This is Pippa. She managed to start the car but is waiting for you to buckle up before driving. Responsible af 11/10 https://t.co/htrlmC7saz,Pippa,,1.1,3584,1020,1020,3584,7418619
7.18972E+17,2016-04-10 01:20:33+00:00,"<a href=""http://twitter.com/download/iphone"" rel=""nofollow"">Twitter for iPhone</a>",This is Sadie. She is prepared for battle. 10/10 https://t.co/JRckDkZVRT,Sadie,,1,3662,1172,1172,3662,7420737
7.18939E+17,2016-04-09 23:10:47+00:00,"<a href=""http://twitter.com/download/iphone"" rel=""nofollow"">Twitter for iPhone</a>",This is Otis. Everybody look at Otis. 12/10 would probably faint while petting https://t.co/I9qoe1uEih,Otis,,1.2,5496,1879,1879,5496,7418620
7.18613E+17,2016-04-09 01:35:37+00:00,"<a href=""http://twitter.com/download/iphone"" rel=""nofollow"">Twitter for iPhone</a>",This is Carper. He's a Tortellini Angiosperm. In desperate need of a petting. 11/10 would hug softly https://t.co/lK9YDkRzPj,Carper,,1.1,2566,514,514,2566,7418620
7.1846E+17,2016-04-08 15:26:28+00:00,"<a href=""http://twitter.com/download/iphone"" rel=""nofollow"">Twitter for iPhone</a>",Meet Bowie. He's listening for underground squirrels. Smart af. Left eye is considerably magical. 9/10 would so pet https://t.co/JyNmyjy3fe,Bowie,,0.9,2833,564,564,2833,7418620
7.18247E+17,2016-04-08 01:19:36+00:00,"<a href=""http://twitter.com/download/iphone"" rel=""nofollow"">Twitter for iPhone</a>",This is Alexanderson. He's got a weird ass birth mark. Dreadful at fetch. Won't eat kibble. 3/10 wtf @Target https://t.co/FmxOpf2Sgl,Alexanderson,,0.3,2027,534,534,2027,7418620
7.18235E+17,2016-04-08 00:30:51+00:00,"<a href=""http://twitter.com/download/iphone"" rel=""nofollow"">Twitter for iPhone</a>",This is Suki. She was born with a blurry tail (unfortunate). Next level tongue tho. 11/10 nifty hardwood https://t.co/05S8oYztgb,Suki,,1.1,4067,1072,1072,4067,7418620
7.17842E+17,2016-04-06 22:29:56+00:00,"<a href=""http://twitter.com/download/iphone"" rel=""nofollow"">Twitter for iPhone</a>",This is Barclay. His father was a banana. 11/10 appeeling af https://t.co/ucOEfr2rjV,Barclay,,1.1,2570,633,633,2570,7418620
7.17429E+17,2016-04-05 19:09:17+00:00,"<a href=""http://vine.co"" rel=""nofollow"">Vine - Make a Scene</a>",This is Skittle. He's trying to communicate. 11/10 solid effort https://t.co/6WTfJvtKx6,Skittle,,1.1,1684,486,486,1684,7418621
7.17422E+17,2016-04-05 18:41:02+00:00,"<a href=""http://twitter.com/download/iphone"" rel=""nofollow"">Twitter for iPhone</a>",This is Ebby. She's a Zimbabwean Feta. Embarrassed by ridiculously squishy face. 9/10 would squeeze softly https://t.co/LBJqxMGaHi,Ebby,,0.9,3303,901,901,3303,7418621
7.17047E+17,2016-04-04 17:53:31+00:00,"<a href=""http://twitter.com/download/iphone"" rel=""nofollow"">Twitter for iPhone</a>",This is FlÃ¡vio (pronounced Baxter). He's a Benesnoop Cumberdog. Super rare. Symmetrical. 12/10 would pet so well https://t.co/fGgleFiBPq,FlÃ¡vio,,1.2,6571,2036,2036,6571,7418621
7.17009E+17,2016-04-04 15:22:08+00:00,"<a href=""http://twitter.com/download/iphone"" rel=""nofollow"">Twitter for iPhone</a>",This is Smokey. He's having some sort of existential crisis. 10/10 hang in there pupper https://t.co/JmgF4dMpw0,Smokey,pupper,1,3436,1043,1043,3436,7418621
7.16803E+17,2016-04-04 01:41:58+00:00,"<a href=""http://twitter.com/download/iphone"" rel=""nofollow"">Twitter for iPhone</a>",This is Link. He struggles with couches. 10/10 would assist https://t.co/SbX4e6Yg3o,Link,,1,4485,1257,1257,4485,7418621
7.16791E+17,2016-04-04 00:55:01+00:00,"<a href=""http://twitter.com/download/iphone"" rel=""nofollow"">Twitter for iPhone</a>",Meet Jennifur. She's supposed to be navigating. Not even buckled up. Insubordinate &amp; churlish. 11/10 would still pet https://t.co/h0trcJohYO,Jennifur,,1.1,6266,1531,1531,6266,7418621
7.16447E+17,2016-04-03 02:08:05+00:00,"<a href=""http://vine.co"" rel=""nofollow"">Vine - Make a Scene</a>",This is Ozzy. He's acrobatic af. Legendary pupper status achieved. 13/10 https://t.co/gHWsCTu90E,Ozzy,pupper,1.3,13747,6295,6295,13747,7418621
7.16439E+17,2016-04-03 01:36:11+00:00,"<a href=""http://twitter.com/download/iphone"" rel=""nofollow"">Twitter for iPhone</a>",This is Bluebert. He just saw that both #FinalFur match ups are split 50/50. Amazed af. 11/10 https://t.co/Kky1DPG4iq,Bluebert,,1,2481,229,229,2481,7418621
7.16286E+17,2016-04-02 15:25:47+00:00,"<a href=""http://twitter.com/download/iphone"" rel=""nofollow"">Twitter for iPhone</a>",This is Stephanus. She stays woke. 12/10 https://t.co/WIWabMngQZ,Stephanus,,1.2,2915,1160,1160,2915,7418621
7.15928E+17,2016-04-01 15:46:52+00:00,"<a href=""http://twitter.com/download/iphone"" rel=""nofollow"">Twitter for iPhone</a>",This is Bubbles. He's a Yorkshire Piccolope. 11/10 would snug aggressively https://t.co/3BhMojONxq,Bubbles,,1.1,3349,933,933,3349,7418621
7.15758E+17,2016-04-01 04:30:16+00:00,"<a href=""http://vine.co"" rel=""nofollow"">Vine - Make a Scene</a>",This is old now but it's absolutely heckin fantastic and I can't not share it with you all. 13/10  https://t.co/wJX74TSgzP,Old,,1.3,3928,1516,1516,3928,7418622
7.15705E+17,2016-04-01 00:58:13+00:00,"<a href=""http://vine.co"" rel=""nofollow"">Vine - Make a Scene</a>",This is Bentley. He gives kisses back. 11/10 precious af (vid by @emmaallen25) https://t.co/9PnKkKzoUp,Bentley,,1.1,2937,605,605,2937,7418622
7.15697E+17,2016-04-01 00:26:15+00:00,"<a href=""http://twitter.com/download/iphone"" rel=""nofollow"">Twitter for iPhone</a>",Meet Toby. He's a Lithuanian High-Steppin Stickeroo. One of the more accomplished Stickeroos around. 10/10 so nifty https://t.co/cYPHuJYTjC,Toby,,1,4101,1377,1377,4101,7418622
7.15681E+17,2016-03-31 23:22:53+00:00,"<a href=""http://twitter.com/download/iphone"" rel=""nofollow"">Twitter for iPhone</a>",This is Zeus. He's downright fabulous. 12/10 https://t.co/sSugyyRuTp,Zeus,,1.2,4543,1731,1731,4543,7418623
7.1536E+17,2016-03-31 02:09:32+00:00,"<a href=""http://twitter.com/download/iphone"" rel=""nofollow"">Twitter for iPhone</a>",This is Bertson. He just wants to say hi. 11/10 would boop nose https://t.co/hwv7Wq6gDA,Bertson,,1.1,5746,1683,1683,5746,7418623
7.15342E+17,2016-03-31 00:58:29+00:00,"<a href=""http://twitter.com/download/iphone"" rel=""nofollow"">Twitter for iPhone</a>",This is Oscar. He's a world renowned snowball inspector. It's a ruff job but someone has to do it. 10/10 great guy https://t.co/vSufMAKm3C,Oscar,,1,3177,729,729,3177,7418623
7.1522E+17,2016-03-30 16:52:36+00:00,"<a href=""http://twitter.com/download/iphone"" rel=""nofollow"">Twitter for iPhone</a>",This is Nico. His selfie game is strong af. Excellent use of a sneaky tongue slip. 10/10 star material https://t.co/1OBdJkMOFx,Nico,,1,2533,698,698,2533,7418623
7.15201E+17,2016-03-30 15:34:51+00:00,"<a href=""http://twitter.com/download/iphone"" rel=""nofollow"">Twitter for iPhone</a>",This is Michelangelope. He's half coffee cup. Rare af. 12/10 would hug until someone stopped me https://t.co/tvVDY0G911,Michelangelope,,1.2,5379,2015,2015,5379,7418623
7.1501E+17,2016-03-30 02:56:24+00:00,"<a href=""http://twitter.com/download/iphone"" rel=""nofollow"">Twitter for iPhone</a>",This is Siba. She's remarkably mobile. Very sleepy as well. 12/10 would happily transport https://t.co/TjnI33RE1i,Siba,,1.2,4371,1323,1323,4371,7418623
7.14982E+17,2016-03-30 01:07:18+00:00,"<a href=""http://twitter.com/download/iphone"" rel=""nofollow"">Twitter for iPhone</a>",This is Calbert. He forgot to clear his Google search history. 9/10 rookie mistake Calbert https://t.co/jRm5J3YCmj,Calbert,,0.9,3942,1108,1108,3942,7418623
7.14958E+17,2016-03-29 23:29:14+00:00,"<a href=""http://twitter.com/download/iphone"" rel=""nofollow"">Twitter for iPhone</a>",This is Curtis. He's an Albino Haberdasher. Terrified of dandelions. They really spook him up. 10/10 it'll be ok pup https://t.co/s8YcfZrWhK,Curtis,,1,4346,1516,1516,4346,7418623
7.14632E+17,2016-03-29 01:53:39+00:00,"<a href=""http://twitter.com/download/iphone"" rel=""nofollow"">Twitter for iPhone</a>",This is Benedict. He's a feisty pup. Needs a brushing. Portable af. Looks very angry actually. 4/10 might not pet https://t.co/3oeFfHjv0Z,Benedict,,0.4,3434,1071,1071,3434,7418623
7.14485E+17,2016-03-28 16:12:09+00:00,"<a href=""http://vine.co"" rel=""nofollow"">Vine - Make a Scene</a>",This is Blitz. He screams. 10/10 (vid by @yeaahliv) https://t.co/MfW2aym5UF,Blitz,,1,2846,1238,1238,2846,7418623
7.14258E+17,2016-03-28 01:10:13+00:00,"<a href=""http://twitter.com/download/iphone"" rel=""nofollow"">Twitter for iPhone</a>","Meet Travis and Flurp. Travis is pretty chill but Flurp can't lie down properly. 10/10 &amp; 8/10
get it together Flurp https://t.co/Akzl5ynMmE",Travis,,1,3159,764,764,3159,7418623
7.14252E+17,2016-03-28 00:43:43+00:00,"<a href=""http://twitter.com/download/iphone"" rel=""nofollow"">Twitter for iPhone</a>",This is Thumas. He hates potted plants. 8/10 wtf Thumas https://t.co/rDVueNIcEi,Thumas,,0.8,3434,900,900,3434,7418623
7.13919E+17,2016-03-27 02:43:58+00:00,"<a href=""http://twitter.com/download/iphone"" rel=""nofollow"">Twitter for iPhone</a>",This is Kanu. He's a Freckled Ticonderoga. Simply flawless. 12/10 would perform an elaborate heist to capture https://t.co/7vyAzIURrE,Kanu,,1.2,3439,829,829,3439,7418623
7.1391E+17,2016-03-27 02:05:49+00:00,"<a href=""http://vine.co"" rel=""nofollow"">Vine - Make a Scene</a>",This is Doug. His nose is legendary af. 12/10 (vid by @probably_trey) https://t.co/7IWKfbfihS,Doug,,1.2,2010,581,581,2010,7418623
7.13761E+17,2016-03-26 16:15:05+00:00,"<a href=""http://twitter.com/download/iphone"" rel=""nofollow"">Twitter for iPhone</a>",This is Piper. She would really like that tennis ball core. Super sneaky tongue slip. 12/10 precious af https://t.co/QP6GHi5az9,Piper,,1.2,5124,1475,1475,5124,7418624
7.13178E+17,2016-03-25 01:35:51+00:00,"<a href=""http://twitter.com/download/iphone"" rel=""nofollow"">Twitter for iPhone</a>",This is Lance. Lance doesn't give a shit. 10/10 we should all be more like Lance https://t.co/SqnG9Ap28J,Lance,,1,7557,3022,3022,7557,7418624
7.13176E+17,2016-03-25 01:29:21+00:00,"<a href=""http://twitter.com/download/iphone"" rel=""nofollow"">Twitter for iPhone</a>",Say hello to Opie and Clarkus. Clarkus fell asleep so Opie buried him. Ruthless af 10/10 for both https://t.co/xT7XaY4gnW,Opie,,1,4685,1558,1558,4685,7418624
7.12809E+17,2016-03-24 01:11:29+00:00,"<a href=""http://twitter.com/download/iphone"" rel=""nofollow"">Twitter for iPhone</a>",This is Stubert. He just arrived. 10/10 https://t.co/HVGs5aAKAn,Stubert,,1,19535,7199,7199,19535,7418624
7.12669E+17,2016-03-23 15:53:42+00:00,"<a href=""http://twitter.com/download/iphone"" rel=""nofollow"">Twitter for iPhone</a>",Say hello to Sunny and Roxy. They pull things out of water together. 10/10 for both https://t.co/88aedAmxcl,Sunny,,1,4368,1301,1301,4368,7418624
7.12438E+17,2016-03-23 00:37:48+00:00,"<a href=""http://twitter.com/download/iphone"" rel=""nofollow"">Twitter for iPhone</a>",This is Kane. He's a semi-submerged Haitian Huffleplop. Happy af. Sick waterfall. 11/10 would pat head approvingly https://t.co/7zjEC501Ul,Kane,,1.1,5590,1673,1673,5590,7418624
7.12093E+17,2016-03-22 01:45:15+00:00,"<a href=""http://twitter.com/download/iphone"" rel=""nofollow"">Twitter for iPhone</a>",This is Steven. He's inverted af. Also very helpful. Scans anything you want for free. Takes him a while tho. 7/10 https://t.co/tA0ZiQ7JcG,Steven,,0.7,3090,961,961,3090,7418624
7.12086E+17,2016-03-22 01:16:55+00:00,"<a href=""http://twitter.com/download/iphone"" rel=""nofollow"">Twitter for iPhone</a>","Say hello to Olive and Ruby. They are best buddies. Both 11/10 
1 like = 1 buddy https://t.co/yagmFdKlyL",Olive,,1.1,3407,518,518,3407,7418625
7.12065E+17,2016-03-21 23:55:01+00:00,"<a href=""http://twitter.com/download/iphone"" rel=""nofollow"">Twitter for iPhone</a>",This is Chester. He's clearly in charge of the other dogs. Weird ass paws. Not fit for fetch. 6/10 would still pet https://t.co/o2GvskrhHt,Chester,,0.6,2381,667,667,2381,7418625
7.11968E+17,2016-03-21 17:30:03+00:00,"<a href=""http://twitter.com/download/iphone"" rel=""nofollow"">Twitter for iPhone</a>",Meet Winston. He's trapped in a cup of coffee. Poor pupper. 10/10 someone free him https://t.co/2e6cUtKUuc,Winston,pupper,1,8466,2467,2467,8466,7418626
7.11744E+17,2016-03-21 02:38:34+00:00,"<a href=""http://twitter.com/download/iphone"" rel=""nofollow"">Twitter for iPhone</a>",Meet Roosevelt. He's calculating the best case scenario if he drops out instead of doing math hw. 11/10 relatable af https://t.co/QcSIRDpfVg,Roosevelt,,1.1,2990,1057,1057,2990,7418626
7.11653E+17,2016-03-20 20:36:28+00:00,"<a href=""http://twitter.com/download/iphone"" rel=""nofollow"">Twitter for iPhone</a>",This is Gary. He just wanted to say hi. 9/10 very personable pup https://t.co/Sk3CbhmKSW,Gary,,0.9,4060,980,980,4060,7418626
7.11008E+17,2016-03-19 01:54:56+00:00,"<a href=""http://twitter.com/download/iphone"" rel=""nofollow"">Twitter for iPhone</a>",This is Chuckles. He had a balloon but he accidentally let go of it and it floated away. 11/10 hang in there pupper https://t.co/68iNM7B5gW,Chuckles,pupper,1.1,3148,663,663,3148,7418626
7.10997E+17,2016-03-19 01:11:29+00:00,"<a href=""http://twitter.com/download/iphone"" rel=""nofollow"">Twitter for iPhone</a>",Meet Milo and Amos. They are the best of pals. Both 12/10 would pet at the same time https://t.co/Mv37BHEyyD,Milo,,1.2,4783,1491,1491,4783,7418627
7.10845E+17,2016-03-18 15:05:29+00:00,"<a href=""http://twitter.com/download/iphone"" rel=""nofollow"">Twitter for iPhone</a>",This is Staniel. His selfie game is strong af. 10/10 I'd snapchat with Staniel https://t.co/UgkTw7TKyM,Staniel,,1,2677,738,738,2677,7418628
7.10833E+17,2016-03-18 14:19:56+00:00,"<a href=""http://twitter.com/download/iphone"" rel=""nofollow"">Twitter for iPhone</a>",Say hello to Sora. She's an Egyptian Pumpernickel. Mesmerizing af. 12/10 would bring home to mom https://t.co/PmTR4kxZkq,Sora,,1.2,2825,576,576,2825,7418628
