tweet_id,timestamp,source,text,name,dog_style,rating,favorite_count_x,retweet_count_x,retweet_count_y,favorite_count_y,followers_count
8.04026E+17,2016-11-30 18:16:08+00:00,"<a href=""http://twitter.com/download/iphone"" rel=""nofollow"">Twitter for iPhone</a>",This is Bo. He's going to make me cry. 13/10 please get off the bus for him Carly https://t.co/U7FvBZo6Bq,Bo,,1.3,48032,17928,17928,48032,7418533
8.03773E+17,2016-11-30 01:31:12+00:00,"<a href=""http://twitter.com/download/iphone"" rel=""nofollow"">Twitter for iPhone</a>",This is Diogi. He fell in the pool as soon as he was brought home. Clumsy puppo. 12/10 would pet until dry https://t.co/ZxeRjMKaWt,Diogi,puppo,1.2,10816,3059,3059,10816,7418533
8.03381E+17,2016-11-28 23:30:47+00:00,"<a href=""http://twitter.com/download/iphone"" rel=""nofollow"">Twitter for iPhone</a>",Meet Sonny. He's an in-home movie critic. That is his collection. He's very proud of it. 12/10 https://t.co/yPbCALoy2n,Sonny,,1.2,8345,2055,2055,8345,7418533
8.03277E+17,2016-11-28 16:37:19+00:00,"<a href=""http://twitter.com/download/iphone"" rel=""nofollow"">Twitter for iPhone</a>",This is Winston. His selfie game is legendary. Will steal your girl with a single snap. 11/10 handsome as h*ck https://t.co/jxQhxoPsgL,Winston,,1.1,10787,2734,2734,10787,7418533
8.02952E+17,2016-11-27 19:09:28+00:00,"<a href=""http://twitter.com/download/iphone"" rel=""nofollow"">Twitter for iPhone</a>",This is Marley. She's having a ruff day. Pretty pupset. 12/10 would assist https://t.co/yLm7hQ6UXh,Marley,,1.2,9717,2222,2222,9717,7418533
8.026E+17,2016-11-26 19:50:26+00:00,"<a href=""http://vine.co"" rel=""nofollow"">Vine - Make a Scene</a>",This is Bailey. She has mastered the head tilt. 11/10 rather h*ckin adorable https://t.co/urhl90ZE1O,Bailey,,1.1,7664,1627,1627,7664,7418534
8.02573E+17,2016-11-26 18:00:13+00:00,"<a href=""http://twitter.com/download/iphone"" rel=""nofollow"">Twitter for iPhone</a>",This is Winnie. She's h*ckin ferocious. Dandelion doesn't even see her coming. 12/10 would pet with caution https://t.co/EFfLCP7oQv,Winnie,,1.2,9622,2767,2767,9622,7418534
8.02324E+17,2016-11-26 01:31:31+00:00,"<a href=""http://twitter.com/download/iphone"" rel=""nofollow"">Twitter for iPhone</a>",This is Severus. He's here to fix your cable. Looks like he succeeded. Even offered to pupgrade your plan. 13/10 h*ckin helpful https://t.co/aX4brLLpWZ,Severus,,1.3,17502,6462,6462,17502,7418534
8.02239E+17,2016-11-25 19:55:35+00:00,"<a href=""http://twitter.com/download/iphone"" rel=""nofollow"">Twitter for iPhone</a>",This is Loki. He'll do your taxes for you. Can also make room in your budget for all the things you bought today. 12/10 what a puppo https://t.co/5oWrHCWg87,Loki,puppo,1.2,9787,2879,2879,9787,7418534
8.01958E+17,2016-11-25 01:18:59+00:00,"<a href=""http://twitter.com/download/iphone"" rel=""nofollow"">Twitter for iPhone</a>",This is Ronnie. He hopes you're having a great day. Nifty tongue slip. 12/10 would pat head approvingly https://t.co/4fY2bsAm65,Ronnie,,1.2,8319,1887,1887,8319,7418534
8.01538E+17,2016-11-23 21:29:33+00:00,"<a href=""http://twitter.com/download/iphone"" rel=""nofollow"">Twitter for iPhone</a>",This is Wallace. He'll be your chau-fur this evening. 12/10 eyes on the road Wallace https://t.co/p1RD39XjUe,Wallace,,1.2,8832,2275,2275,8832,7418534
8.01168E+17,2016-11-22 20:58:07+00:00,"<a href=""http://twitter.com/download/iphone"" rel=""nofollow"">Twitter for iPhone</a>",This is Milo. I would do terrible things for Milo. 13/10 https://t.co/R6wJyC2Tey,Milo,,1.3,26398,6574,6574,26398,7418534
8.01115E+17,2016-11-22 17:28:25+00:00,"<a href=""http://twitter.com/download/iphone"" rel=""nofollow"">Twitter for iPhone</a>",This is Bones. He's being haunted by another doggo of roughly the same size. 12/10 deep breaths pupper everything's fine https://t.co/55Dqe0SJNj,Bones,doggo,1.2,8712,2314,2314,8712,7418535
8.00752E+17,2016-11-21 17:23:47+00:00,"<a href=""http://twitter.com/download/iphone"" rel=""nofollow"">Twitter for iPhone</a>",Say hello to Mauve and Murphy. They're rather h*ckin filthy. Preferred nap over bath. Both 12/10 https://t.co/4UwCTW3lXG,Mauve,,1.2,11309,3071,3071,11309,7418535
8.00513E+17,2016-11-21 01:37:04+00:00,"<a href=""http://twitter.com/download/iphone"" rel=""nofollow"">Twitter for iPhone</a>",This is Chef. Chef loves everyone and wants everyone to love each other. 11/10 https://t.co/ILHGs0e6Dm,Chef,,1.1,14146,3327,3327,14146,7418535
8.00388E+17,2016-11-20 17:20:08+00:00,"<a href=""http://twitter.com/download/iphone"" rel=""nofollow"">Twitter for iPhone</a>",This is Doc. He takes time out of every day to worship our plant overlords. 12/10 quite the floofer https://t.co/azMneS6Ly5,Doc,floofer,1.2,12018,3103,3103,12018,7418535
8.00141E+17,2016-11-20 00:59:15+00:00,"<a href=""http://twitter.com/download/iphone"" rel=""nofollow"">Twitter for iPhone</a>",This is Peaches. She's the ultimate selfie sidekick. Super sneaky tongue slip appreciated. 13/10 https://t.co/pbKOesr8Tg,Peaches,,1.3,16487,2837,2837,16487,7418535
7.99758E+17,2016-11-18 23:35:32+00:00,"<a href=""http://twitter.com/download/iphone"" rel=""nofollow"">Twitter for iPhone</a>",This is Sobe. She's a h*ckin happy doggo. Only one leg tho. Must have good balance. 13/10 would smile back https://t.co/OiH8PaOxB1,Sobe,doggo,1.3,9065,2393,2393,9065,7418535
7.99423E+17,2016-11-18 01:24:14+00:00,"<a href=""http://twitter.com/download/iphone"" rel=""nofollow"">Twitter for iPhone</a>",This is Longfellow (prolly sophisticated). He's a North Appalachian Oatzenjammer. Concerned about wrinkled feets. 12/10 would hug softly https://t.co/bpLuQuxzHZ,Longfellow,,1.2,8667,2118,2118,8667,7418535
7.99297E+17,2016-11-17 17:04:16+00:00,"<a href=""http://twitter.com/download/iphone"" rel=""nofollow"">Twitter for iPhone</a>",This is Jeffrey. He's quite the jokester. Takes it too far sometimes. Still 11/10 would pet https://t.co/YDtZcAiMAf,Jeffrey,,1.1,10682,3067,3067,10682,7418535
7.99063E+17,2016-11-17 01:35:54+00:00,"<a href=""http://twitter.com/download/iphone"" rel=""nofollow"">Twitter for iPhone</a>",This is Mister. He only wears the most fashionable af headwear. 11/10 h*ckin stylish https://t.co/BXJFKOVnJm,Mister,,1.1,8729,2726,2726,8729,7418535
7.98934E+17,2016-11-16 17:01:16+00:00,"<a href=""http://twitter.com/download/iphone"" rel=""nofollow"">Twitter for iPhone</a>",This is Iroh. He's in a predicament. 12/10 someone help him https://t.co/KJAKO2kXsL,Iroh,,1.2,14191,4957,4957,14191,7418535
7.98926E+17,2016-11-16 16:28:21+00:00,"<a href=""http://twitter.com/download/iphone"" rel=""nofollow"">Twitter for iPhone</a>",This is Shadow. He's a firm believer that they're all good dogs. H*ckin passionate about it too. 11/10 I stand with Shadow https://t.co/8yvpacwBcu,Shadow,,1.1,8014,1591,1591,8014,7418535
7.9821E+17,2016-11-14 17:03:50+00:00,"<a href=""http://twitter.com/download/iphone"" rel=""nofollow"">Twitter for iPhone</a>",This is Cooper. His bow tie was too heavy for the front so he moved it to the side. Balanced af now. 13/10 https://t.co/jG1PAFkB81,Cooper,,1.3,11191,2831,2831,11191,7418537
7.97545E+17,2016-11-12 21:02:38+00:00,"<a href=""http://twitter.com/download/iphone"" rel=""nofollow"">Twitter for iPhone</a>",This is Cassie. She steals things. Guilt increases slightly each time. 12/10 would forgive almost immediately https://t.co/Ia19irLwyB,Cassie,,1.2,15628,5375,5375,15628,7418539
7.97237E+17,2016-11-12 00:36:46+00:00,"<a href=""http://twitter.com/download/iphone"" rel=""nofollow"">Twitter for iPhone</a>",This is Pancake. She loves Batman and winks like a h*ckin champ. 12/10 real crowd pleaser https://t.co/6kqsAjJNhi,Pancake,,1.2,21560,7339,7339,21560,7418538
7.96866E+17,2016-11-11 00:03:42+00:00,"<a href=""http://twitter.com/download/iphone"" rel=""nofollow"">Twitter for iPhone</a>",This is Tyr. He's just checking on you. Nifty af tongue slip. 12/10 would absolutely pet https://t.co/Jgnuiyvq06,Tyr,,1.2,8281,2106,2106,8281,7418538
7.9676E+17,2016-11-10 17:02:03+00:00,"<a href=""http://twitter.com/download/iphone"" rel=""nofollow"">Twitter for iPhone</a>",Say hello to Romeo. He was just told that it's too cold for the pool. H*ckin nonsense. 11/10 would help fill up https://t.co/6hx7ur6sNI,Romeo,,1.1,12795,3382,3382,12795,7418538
7.96387E+17,2016-11-09 16:22:22+00:00,"<a href=""http://twitter.com/download/iphone"" rel=""nofollow"">Twitter for iPhone</a>",This is Snicku. He's having trouble reading because he's a dog. Glasses only helped a little. Nap preferred. 12/10 would snug well https://t.co/cVLUasbKA5,Snicku,,1.2,11866,4611,4611,11866,7418538
7.9615E+17,2016-11-09 00:37:46+00:00,"<a href=""http://twitter.com/download/iphone"" rel=""nofollow"">Twitter for iPhone</a>",This is Ruby. She just turned on the news. Officially terrified. 11/10 deep breaths Ruby https://t.co/y5KarNXWXt,Ruby,,1.1,34884,15838,15838,34884,7418538
7.9608E+17,2016-11-08 20:00:55+00:00,"<a href=""http://twitter.com/download/iphone"" rel=""nofollow"">Twitter for iPhone</a>",This is Yogi. He's 98% floof. Snuggable af. 12/10 https://t.co/opoXKxmfFm,Yogi,,1.2,9117,2570,2570,9117,7418539
7.96031E+17,2016-11-08 16:47:50+00:00,"<a href=""http://twitter.com/download/iphone"" rel=""nofollow"">Twitter for iPhone</a>",This is Daisy. She's here to make your day better. 13/10 mission h*ckin successful https://t.co/PbgvuD0qIL,Daisy,,1.3,11645,4079,4079,11645,7418539
7.954E+17,2016-11-06 22:59:35+00:00,"<a href=""http://twitter.com/download/iphone"" rel=""nofollow"">Twitter for iPhone</a>",This is Brody. He's trying to make the same face as the football. 12/10 https://t.co/2H4MfOGlpQ,Brody,,1.2,10895,3171,3171,10895,7418539
7.95077E+17,2016-11-06 01:33:58+00:00,"<a href=""http://twitter.com/download/iphone"" rel=""nofollow"">Twitter for iPhone</a>",This is Bailey. She loves going down slides but is very bad at it. Still 11/10 https://t.co/ivPWhspN3E,Bailey,,1.1,17497,6007,6007,17497,7418539
7.94927E+17,2016-11-05 15:37:24+00:00,"<a href=""http://twitter.com/download/iphone"" rel=""nofollow"">Twitter for iPhone</a>",This is Mack. He's rather h*ckin sleepy. Exceptional ears. 12/10 would boop https://t.co/XRPvTPF0VH,Mack,,1.2,11083,2556,2556,11083,7418539
7.94332E+17,2016-11-04 00:15:59+00:00,"<a href=""http://twitter.com/download/iphone"" rel=""nofollow"">Twitter for iPhone</a>",This is Nimbus (like the cloud). He just bought this fancy af duck raincoat. Only protects one ear tho. 12/10 so h*ckin floofy https://t.co/SIQbb8c3AU,Nimbus,,1.2,10317,2929,2929,10317,7418539
7.94205E+17,2016-11-03 15:51:10+00:00,"<a href=""http://twitter.com/download/iphone"" rel=""nofollow"">Twitter for iPhone</a>",This is Laika. She was a space pupper. The first space pupper actually. Orbited earth like a h*ckin boss. 14/10 hero af https://t.co/trSjgY3h4g,Laika,pupper,1.4,9909,3659,3659,9909,7418539
7.93962E+17,2016-11-02 23:45:19+00:00,"<a href=""http://twitter.com/download/iphone"" rel=""nofollow"">Twitter for iPhone</a>",This is Maximus. His face is stuck like that. Tragic really. Great tongue tho. 12/10 would pet firmly https://t.co/xIfrsMNLBR,Maximus,,1.2,18143,5411,5411,18143,7418539
7.93845E+17,2016-11-02 16:00:06+00:00,"<a href=""http://twitter.com/download/iphone"" rel=""nofollow"">Twitter for iPhone</a>",This is Clark. He was just caught wearing pants. 13/10 game-changing af https://t.co/2Xo19aPrG5,Clark,,1.3,9914,2078,2078,9914,7418539
7.93602E+17,2016-11-01 23:53:02+00:00,"<a href=""http://twitter.com/download/iphone"" rel=""nofollow"">Twitter for iPhone</a>",This is Dobby. I can't stop looking at her feet. 12/10 would absolutely snug https://t.co/LhzPWv6rTv,Dobby,,1.2,8597,1812,1812,8597,7418539
7.93501E+17,2016-11-01 17:12:16+00:00,"<a href=""http://twitter.com/download/iphone"" rel=""nofollow"">Twitter for iPhone</a>",This is Fiona. She's an extremely mediocre copilot. Very distracting. Wink makes up for all the missed turns. 12/10 https://t.co/aF5MmpvPqN,Fiona,,1.2,11525,2637,2637,11525,7418539
7.93286E+17,2016-11-01 03:00:09+00:00,"<a href=""http://twitter.com/download/iphone"" rel=""nofollow"">Twitter for iPhone</a>",This is Moreton. He's the Good Boy Who Lived. 13/10 magical as h*ck https://t.co/rLHGx3VAF3,Moreton,,1.3,26539,10181,10181,26539,7418539
7.93271E+17,2016-11-01 02:00:14+00:00,"<a href=""http://twitter.com/download/iphone"" rel=""nofollow"">Twitter for iPhone</a>",Meet Dave. It's his favorite day of the year. He gets to fulfill his dream of being a dinosaur. 12/10 inspirational af https://t.co/MgQSdfZGPN,Dave,,1.2,9316,2619,2619,9316,7418539
7.93241E+17,2016-11-01 00:00:38+00:00,"<a href=""http://twitter.com/download/iphone"" rel=""nofollow"">Twitter for iPhone</a>",This is Tucker. He's out here bustin h*ckin ghosts. 13/10 dedicated af https://t.co/Ap477GhwXt,Tucker,,1.3,11343,3627,3627,11343,7418539
7.93226E+17,2016-10-31 23:00:11+00:00,"<a href=""http://twitter.com/download/iphone"" rel=""nofollow"">Twitter for iPhone</a>","This is Juno. She spooked me up real good, but only to get my attention. Above average handwriting for a dog I think. 11/10 https://t.co/hFxxBCWlwj",Juno,,1.1,10613,3168,3168,10613,7418539
7.93211E+17,2016-10-31 22:00:04+00:00,"<a href=""http://twitter.com/download/iphone"" rel=""nofollow"">Twitter for iPhone</a>",This is Maude. She's the h*ckin happiest wasp you've ever seen. 10/10 would pet with caution https://t.co/etL8FHBrh8,Maude,,1,9628,3114,3114,9628,7418539
7.93196E+17,2016-10-31 21:00:23+00:00,"<a href=""http://twitter.com/download/iphone"" rel=""nofollow"">Twitter for iPhone</a>",Say hello to Lily. She's pupset that her costume doesn't fit as well as last year. 12/10 poor puppo https://t.co/YSi6K1firY,Lily,puppo,1.2,16453,6223,6223,16453,7418539
7.93181E+17,2016-10-31 20:00:05+00:00,"<a href=""http://twitter.com/download/iphone"" rel=""nofollow"">Twitter for iPhone</a>",This is Newt. He's a strawberry. 11/10 https://t.co/2VhmlwxA1Q,Newt,,1.1,7454,2200,2200,7454,7418539
7.93166E+17,2016-10-31 19:00:10+00:00,"<a href=""http://twitter.com/download/iphone"" rel=""nofollow"">Twitter for iPhone</a>",This is Benji. He's Air Bud. It's a low effort costume but he pulls it off rather h*ckin well. 12/10 would happily get dunked on https://t.co/IbzT7DJvBo,Benji,,1.2,10135,3082,3082,10135,7418539
7.93151E+17,2016-10-31 18:00:14+00:00,"<a href=""http://twitter.com/download/iphone"" rel=""nofollow"">Twitter for iPhone</a>",This is Nida. She's a free elf. Waited so long for this day. 11/10 https://t.co/3lE8Izgmkf,Nida,,1.1,6646,1888,1888,6646,7418539
7.9312E+17,2016-10-31 16:00:13+00:00,"<a href=""http://twitter.com/download/iphone"" rel=""nofollow"">Twitter for iPhone</a>","This is Robin. She's desperately trying to do me a frighten, but her tongue drastically decreases her spook value. Still 11/10 great effort https://t.co/sxMrsOZ8zb",Robin,,1.1,13685,4328,4328,13685,7418540
7.92884E+17,2016-10-31 00:20:11+00:00,"<a href=""http://twitter.com/download/iphone"" rel=""nofollow"">Twitter for iPhone</a>",This is Bailey. She's rather h*ckin hype for Halloween tomorrow. Carved those pupkins herself. 12/10 https://t.co/v17mFm0Ftz,Bailey,,1.2,12201,4730,4730,12201,7418540
7.92774E+17,2016-10-30 17:02:53+00:00,"<a href=""http://twitter.com/download/iphone"" rel=""nofollow"">Twitter for iPhone</a>",This is Monster. Not an actual monster tho. He's showing you his tongue. Very impressive Monster. 12/10 would snug https://t.co/RhaPExuxJL,Monster,,1.2,7917,1860,1860,7917,7418540
7.92395E+17,2016-10-29 15:55:58+00:00,"<a href=""http://twitter.com/download/iphone"" rel=""nofollow"">Twitter for iPhone</a>",Meet BeBe. She rocks the messy bun of your dreams. H*ckin flawless. 12/10 would watch her tutorial https://t.co/of0pFNBIl8,Bebe,,1.2,14519,4743,4743,14519,7418540
7.9205E+17,2016-10-28 17:07:05+00:00,"<a href=""http://twitter.com/download/iphone"" rel=""nofollow"">Twitter for iPhone</a>",This is Remus. He's a mop that came to life. Can't see anything. Constantly trips over himself. Still a very good dog. 11/10 https://t.co/S3f1SYylzu,Remus,,1.1,7734,1987,1987,7734,7418540
7.91407E+17,2016-10-26 22:31:36+00:00,"<a href=""http://twitter.com/download/iphone"" rel=""nofollow"">Twitter for iPhone</a>",Say hello to Levi. He's a Madagascan Butterbop. One of the more docile Butterbops I've seen. 12/10 would give all the pets https://t.co/Zcw9Sccctc,Levi,,1.2,14150,4554,4554,14150,7418540
7.91312E+17,2016-10-26 16:14:55+00:00,"<a href=""http://twitter.com/download/iphone"" rel=""nofollow"">Twitter for iPhone</a>",This is Mabel. She's super h*ckin smol. Portable af. Comes with the smol shoe. 12/10 would keep in frocket https://t.co/GGJvxYt3xK,Mabel,,1.2,9467,2814,2814,9467,7418540
7.90987E+17,2016-10-25 18:44:32+00:00,"<a href=""http://twitter.com/download/iphone"" rel=""nofollow"">Twitter for iPhone</a>",This is Misty. She has a cowboy hat on her nose. 12/10 https://t.co/Eno0mypHIr,Misty,,1.2,10664,2364,2364,10664,7418540
7.90946E+17,2016-10-25 16:00:09+00:00,"<a href=""http://twitter.com/download/iphone"" rel=""nofollow"">Twitter for iPhone</a>",This is Betty. She's assisting with the dishes. Such a good puppo. 12/10 h*ckin helpful af https://t.co/dgvTPZ9tgI,Betty,puppo,1.2,17898,5191,5191,17898,7418540
7.90699E+17,2016-10-24 23:37:28+00:00,"<a href=""http://twitter.com/download/iphone"" rel=""nofollow"">Twitter for iPhone</a>",This is Mosby. He appears to be rather h*ckin snuggable af. 12/10 keep it up Mosby https://t.co/IiiBq460I7,Mosby,,1.2,8831,2107,2107,8831,7418540
7.90582E+17,2016-10-24 15:53:19+00:00,"<a href=""http://twitter.com/download/iphone"" rel=""nofollow"">Twitter for iPhone</a>",This is Duke. He sneaks into the fridge sometimes. It's his safe place. 11/10 would give little jacket if necessary https://t.co/Fd5WFDTMH4,Duke,,1.1,22281,7936,7936,22281,7418540
7.90338E+17,2016-10-23 23:42:19+00:00,"<a href=""http://twitter.com/download/iphone"" rel=""nofollow"">Twitter for iPhone</a>",Meet Maggie. She can hear your cells divide. 12/10 can also probably fly https://t.co/ovE2hqXryV,Maggie,,1.2,8430,2064,2064,8430,7418540
7.90277E+17,2016-10-23 19:42:02+00:00,"<a href=""http://twitter.com/download/iphone"" rel=""nofollow"">Twitter for iPhone</a>",This is Bruce. He never backs down from a challenge. 11/10 you got this Bruce https://t.co/aI7umZHIq7,Bruce,,1.1,13508,3527,3527,13508,7418540
7.89986E+17,2016-10-23 00:27:05+00:00,"<a href=""http://twitter.com/download/iphone"" rel=""nofollow"">Twitter for iPhone</a>",This is Happy. He's a bathtub reviewer. Seems to be pleased with this one. 12/10 https://t.co/Ln89R4FP7v,Happy,,1.2,9967,2566,2566,9967,7418540
7.89904E+17,2016-10-22 18:57:48+00:00,"<a href=""http://vine.co"" rel=""nofollow"">Vine - Make a Scene</a>",This is Ralphy. His dreams were just shattered. Poor pupper. 13/10 it'll be ok Ralphy https://t.co/P0kSN6rT6H,Ralphy,pupper,1.3,11204,4564,4564,11204,7418540
7.89629E+17,2016-10-22 00:45:17+00:00,"<a href=""http://twitter.com/download/iphone"" rel=""nofollow"">Twitter for iPhone</a>",This is Eli. He can fly. 13/10 magical af https://t.co/huPSJJ7FDI,Eli,,1.3,8100,1970,1970,8100,7418540
7.89599E+17,2016-10-21 22:48:24+00:00,"<a href=""http://twitter.com/download/iphone"" rel=""nofollow"">Twitter for iPhone</a>",This is Brownie. She's wearing a Halloween themed onesie. 12/10 festive af https://t.co/0R4meWXFOx,Brownie,,1.2,7292,2142,2142,7292,7418540
7.89531E+17,2016-10-21 18:16:44+00:00,"<a href=""http://twitter.com/download/iphone"" rel=""nofollow"">Twitter for iPhone</a>",This is Rizzy. She smiles a lot. 12/10 contagious af https://t.co/TU4sZogVIq,Rizzy,,1.2,12677,3729,3729,12677,7418540
7.89268E+17,2016-10-21 00:53:56+00:00,"<a href=""http://twitter.com/download/iphone"" rel=""nofollow"">Twitter for iPhone</a>",This is Stella. She's happier than I will ever be. 10/10 would trade lives with https://t.co/JSs2bfDtTS,Stella,,1,9817,2850,2850,9817,7418541
7.89138E+17,2016-10-20 16:15:26+00:00,"<a href=""http://twitter.com/download/iphone"" rel=""nofollow"">Twitter for iPhone</a>",This is Bo. He's a West Congolese Bugaboop Snuggle. Rather exotic. Master of the head tilt. 12/10 would pay to pet https://t.co/2jwxxtNzoN,Bo,,1.2,10451,3089,3089,10451,7418541
7.88908E+17,2016-10-20 01:03:11+00:00,"<a href=""http://twitter.com/download/iphone"" rel=""nofollow"">Twitter for iPhone</a>","This is Lucy. She destroyed not one, but two remotes trying to turn off the debate. 11/10 relatable af https://t.co/3BXh073tDm",Lucy,,1.1,29513,13689,13689,29513,7418542
7.88766E+17,2016-10-19 15:37:03+00:00,"<a href=""http://twitter.com/download/iphone"" rel=""nofollow"">Twitter for iPhone</a>",This is Butter. She can have whatever she wants forever. 12/10 would hug softly https://t.co/x5gXRS1abq,Butter,,1.2,29544,11379,11379,29544,7418542
7.88412E+17,2016-10-18 16:11:17+00:00,"<a href=""http://twitter.com/download/iphone"" rel=""nofollow"">Twitter for iPhone</a>",This is Dexter. He breaks hearts for a living. 11/10 h*ckin handsome af https://t.co/4DhSsC1W7S,Dexter,,1.1,16804,5859,5859,16804,7418542
7.88151E+17,2016-10-17 22:51:57+00:00,"<a href=""http://twitter.com/download/iphone"" rel=""nofollow"">Twitter for iPhone</a>",This is Leo. He's a golden chow. Rather h*ckin rare. 13/10 would give extra pats https://t.co/xosHjFzVXc,Leo,,1.3,6633,1439,1439,6633,7418542
7.87811E+17,2016-10-17 00:20:47+00:00,"<a href=""http://twitter.com/download/iphone"" rel=""nofollow"">Twitter for iPhone</a>",This is Frank. He wears sunglasses and walks himself. 11/10 I'll never be this cool or independent https://t.co/pNNjBtHWPc,Frank,,1.1,9350,3369,3369,9350,7418542
7.87718E+17,2016-10-16 18:11:26+00:00,"<a href=""http://twitter.com/download/iphone"" rel=""nofollow"">Twitter for iPhone</a>",This is Tonks. She is a service puppo. Can hear a caterpillar hiccup from 7 miles away. 13/10 would follow anywhere https://t.co/i622ZbWkUp,Tonks,puppo,1.3,10997,3074,3074,10997,7418542
7.87398E+17,2016-10-15 21:01:17+00:00,"<a href=""http://twitter.com/download/iphone"" rel=""nofollow"">Twitter for iPhone</a>",This is Moose. He's rather h*ckin dangerous (you can tell by the collar). 11/10 would still attempt to snug https://t.co/lHVHGdDzb3,Moose,,1.1,11673,3132,3132,11673,7418542
7.87322E+17,2016-10-15 16:01:13+00:00,"<a href=""http://twitter.com/download/iphone"" rel=""nofollow"">Twitter for iPhone</a>",This is Lincoln. He forgot to use his blinker when he changed lanes just now. Guilty as h*ck. Still 10/10 https://t.co/lsrR83SiVp,Lincoln,,1,8388,1924,1924,8388,7418542
7.86963E+17,2016-10-14 16:13:10+00:00,"<a href=""http://twitter.com/download/iphone"" rel=""nofollow"">Twitter for iPhone</a>",This is Rory. He's got an interview in a few minutes. Looking spiffy af. Nervous as h*ck tho. 12/10 would hire https://t.co/ibj5g6xaAj,Rory,,1.2,28608,8826,8826,28608,7418542
7.86709E+17,2016-10-13 23:23:56+00:00,"<a href=""http://twitter.com/download/iphone"" rel=""nofollow"">Twitter for iPhone</a>","This is Logan, the Chow who lived. He solemnly swears he's up to lots of good. H*ckin magical af 9.75/10 https://t.co/yBO5wuqaPS",Logan,,7.5,19561,6719,6719,19561,7418542
7.86596E+17,2016-10-13 15:54:28+00:00,"<a href=""http://twitter.com/download/iphone"" rel=""nofollow"">Twitter for iPhone</a>",This is Dale. He's a real spookster. Did me quite the frighten. 11/10 not too spooky to pet tho https://t.co/L8BWDD4oBX,Dale,,1.1,10127,3417,3417,10127,7418542
7.86363E+17,2016-10-13 00:29:39+00:00,"<a href=""http://twitter.com/download/iphone"" rel=""nofollow"">Twitter for iPhone</a>",This is Rizzo. He has many talents. A true renaissance doggo. 13/10 entertaining af https://t.co/TVXpEJB7Wn,Rizzo,doggo,1.3,11739,3872,3872,11739,7418542
7.86286E+17,2016-10-12 19:24:27+00:00,"<a href=""http://vine.co"" rel=""nofollow"">Vine - Make a Scene</a>",This is Arnie. He's afraid of his own bark. 12/10 would comfort https://t.co/ObT2tSxXit,Arnie,,1.2,8587,3159,3159,8587,7418542
7.86234E+17,2016-10-12 15:55:59+00:00,"<a href=""http://twitter.com/download/iphone"" rel=""nofollow"">Twitter for iPhone</a>",This is Mattie. She's extremely dangerous. Will bite your h*ckin finger right off. Still 11/10 would pet with caution https://t.co/78c9W8kLFh,Mattie,,1.1,16476,5271,5271,16476,7418542
7.85928E+17,2016-10-11 19:39:28+00:00,"<a href=""http://twitter.com/download/iphone"" rel=""nofollow"">Twitter for iPhone</a>",This is Lucy. She's strives to be the best potato she can be. 12/10 would boop https://t.co/lntsj7Fc4Y,Lucy,,1.2,12225,3487,3487,12225,7418543
7.85873E+17,2016-10-11 16:00:24+00:00,"<a href=""http://twitter.com/download/iphone"" rel=""nofollow"">Twitter for iPhone</a>",Meet Rusty. He appears to be rather h*ckin fluffy. Also downright adorable af. 12/10 would rub my face against his https://t.co/1j9kLGb4wV,Rusty,,1.2,7189,2017,2017,7189,7418543
7.8564E+17,2016-10-11 00:34:48+00:00,"<a href=""http://twitter.com/download/iphone"" rel=""nofollow"">Twitter for iPhone</a>",This is Pinot. He's a sophisticated doggo. You can tell by the hat. Also pointier than your average pupper. Still 10/10 would pet cautiously https://t.co/f2wmLZTPHd,Pinot,doggo,1,8405,2450,2450,8405,7418543
7.85533E+17,2016-10-10 17:32:08+00:00,"<a href=""http://twitter.com/download/iphone"" rel=""nofollow"">Twitter for iPhone</a>",This is Dallas. Her tongue is ridiculous. 11/10 h*ckin proud af https://t.co/h4jhlH4EyG,Dallas,,1.1,9798,2216,2216,9798,7418543
7.85265E+17,2016-10-09 23:44:41+00:00,"<a href=""http://twitter.com/download/iphone"" rel=""nofollow"">Twitter for iPhone</a>",This is Doc. He requested to be carried around like that. 12/10 anything for Doc https://t.co/mWYACm4qnx,Doc,,1.2,7806,1805,1805,7806,7418543
7.85171E+17,2016-10-09 17:31:53+00:00,"<a href=""http://twitter.com/download/iphone"" rel=""nofollow"">Twitter for iPhone</a>",This is Hero. He was enjoying the car ride until he remembered that bees are dying globally at an alarming rate. 11/10 https://t.co/cubFg7F4qQ,Hero,,1.1,13020,5361,5361,13020,7418543
