tweet_id,timestamp,source,text,name,dog_style,rating,favorite_count_x,retweet_count_x,retweet_count_y,favorite_count_y,followers_count
6.81891E+17,2015-12-29 17:36:07+00:00,"<a href=""http://twitter.com/download/iphone"" rel=""nofollow"">Twitter for iPhone</a>",Say hello to Charlie. He's scholarly af. Quite intimidating with all his pupper knowledge 10/10 even built that fire https://t.co/9KThv6z8u5,Charlie,pupper,1,2601,891,891,2601,7418664
6.81694E+17,2015-12-29 04:31:49+00:00,"<a href=""http://twitter.com/download/iphone"" rel=""nofollow"">Twitter for iPhone</a>",This is Bo. He's a Benedoop Cumbersnatch. Seems frustrated with own feet. Portable as hell. 11/10 very solid pupper https://t.co/TONMhRoQh7,Bo,pupper,1.1,13469,4359,4359,13469,7418664
6.81654E+17,2015-12-29 01:52:46+00:00,"<a href=""http://twitter.com/download/iphone"" rel=""nofollow"">Twitter for iPhone</a>",This is Toffee. He's a happy pupper. Appears dangerously fluffy. Extraordinarily spherical. 12/10 would pet firmly https://t.co/oEXEKt3MHu,Toffee,pupper,1.2,2789,998,998,2789,7418664
6.8158E+17,2015-12-28 20:57:50+00:00,"<a href=""http://twitter.com/download/iphone"" rel=""nofollow"">Twitter for iPhone</a>",This is Apollo. He thought you weren't coming back so he had a mental breakdown. 8/10 we've all been there https://t.co/ojUBrDCHLT,Apollo,,0.8,3738,1406,1406,3738,7418664
6.81523E+17,2015-12-28 17:12:42+00:00,"<a href=""http://twitter.com/download/iphone"" rel=""nofollow"">Twitter for iPhone</a>",This is Carly. She's actually 2 dogs fused together. Very innovative. Probably has superpowers. 12/10 for double dog https://t.co/GQn2IopLud,Carly,,1.2,15099,6264,6264,15099,7418665
6.81339E+17,2015-12-28 05:02:37+00:00,"<a href=""http://twitter.com/download/iphone"" rel=""nofollow"">Twitter for iPhone</a>",This is Asher. He's not wearing a seatbelt or keeping both paws on the wheel. Absolute menace on the roadways. 9/10 https://t.co/V3SWuHACkh,Asher,,0.9,9781,4374,4374,9781,7418667
6.8132E+17,2015-12-28 03:46:05+00:00,"<a href=""http://twitter.com/download/iphone"" rel=""nofollow"">Twitter for iPhone</a>",This is Glacier. He's a very happy pup. Loves to sing in the sunlight. 11/10 https://t.co/jTBPqKgkz7,Glacier,,1.1,2798,817,817,2798,7418667
6.81302E+17,2015-12-28 02:35:15+00:00,"<a href=""http://twitter.com/download/iphone"" rel=""nofollow"">Twitter for iPhone</a>",This is Chuck. He's a neat dog. Very flexible. Trapped in a glass case of emotion. Devastatingly unfluffy 3/10 https://t.co/YqbU9xHV3p,Chuck,,0.3,4162,1973,1973,4162,7418667
6.81297E+17,2015-12-28 02:15:26+00:00,"<a href=""http://twitter.com/download/iphone"" rel=""nofollow"">Twitter for iPhone</a>","This is actually a lion. We only rate dogs. For the last time please only send dogs. Thank u.
12/10 would still pet https://t.co/Pp26dMQxap",Actually,,1.2,3367,1030,1030,3367,7418667
6.81282E+17,2015-12-28 01:12:59+00:00,"<a href=""http://twitter.com/download/iphone"" rel=""nofollow"">Twitter for iPhone</a>",Meet Sarge. His parents signed him up for dancing lessons but his true passion is roller coasters 11/10 very petable https://t.co/KvVoBIgkje,Sarge,,1.1,3391,1184,1184,3391,7418668
6.81262E+17,2015-12-27 23:53:05+00:00,"<a href=""http://twitter.com/download/iphone"" rel=""nofollow"">Twitter for iPhone</a>",Say hello to Panda. He's a Quackadilly Shooster. Not amused by your fake ball throwing motion. 9/10 would hug lots https://t.co/wL1iDvbcVk,Panda,,0.9,1536,297,297,1536,7418668
6.81242E+17,2015-12-27 22:37:04+00:00,"<a href=""http://twitter.com/download/iphone"" rel=""nofollow"">Twitter for iPhone</a>",This is Champ. He's being sacrificed to the Aztec sun god Huitzilopochtli. So sad. 10/10 Champ doesn't deserve this https://t.co/VGsziXImoy,Champ,,1,1579,583,583,1579,7418668
6.81193E+17,2015-12-27 19:22:30+00:00,"<a href=""http://twitter.com/download/iphone"" rel=""nofollow"">Twitter for iPhone</a>",This is Aspen. He's astronomically fluffy. I wouldn't stop petting this dog if the world was ending around me 11/10 https://t.co/oBlgL9nxpx,Aspen,,1.1,3917,1608,1608,3917,7418668
6.80959E+17,2015-12-27 03:51:18+00:00,"<a href=""http://twitter.com/download/iphone"" rel=""nofollow"">Twitter for iPhone</a>",This is Ozzie. He was doing fine until he lost traction in those festive socks. Now he's tired. 9/10 still killin it https://t.co/u4FYdIRKnY,Ozzie,,0.9,4799,2148,2148,4799,7418668
6.8094E+17,2015-12-27 02:36:20+00:00,"<a href=""http://twitter.com/download/iphone"" rel=""nofollow"">Twitter for iPhone</a>",This is Alice. She's an idiot. 4/10 https://t.co/VQXdwJfkyS,Alice,,0.4,3395,1138,1138,3395,7418668
6.80935E+17,2015-12-27 02:15:25+00:00,"<a href=""http://twitter.com/download/iphone"" rel=""nofollow"">Twitter for iPhone</a>",Say hello to Sadie. She's a Tortellini Sidewinder. Very jubilant pup. Seems loyal. Leaves on point. 10/10 petable af https://t.co/g2bTu4ayPl,Sadie,,1,2186,474,474,2186,7418668
6.80913E+17,2015-12-27 00:49:49+00:00,"<a href=""http://twitter.com/download/iphone"" rel=""nofollow"">Twitter for iPhone</a>",Meet Griswold. He's dapper as hell. Already pumped for next Christmas. 11/10 https://t.co/5NrpNDyFzN,Griswold,,1.1,2521,666,666,2521,7418669
6.8089E+17,2015-12-26 23:15:17+00:00,"<a href=""http://twitter.com/download/iphone"" rel=""nofollow"">Twitter for iPhone</a>",This is Cheesy. It's her birthday. She's patiently waiting to eat her party muffin. 9/10 happy birthday pup https://t.co/cH2H7mch2H,Cheesy,,0.9,1862,395,395,1862,7418669
6.80836E+17,2015-12-26 19:43:36+00:00,"<a href=""http://twitter.com/download/iphone"" rel=""nofollow"">Twitter for iPhone</a>",This is Ellie. She's secretly ferocious. 12/10 very deadly pupper https://t.co/BF4BW8LUgb,Ellie,pupper,1.2,3645,1430,1430,3645,7418669
6.80798E+17,2015-12-26 17:12:55+00:00,"<a href=""http://twitter.com/download/iphone"" rel=""nofollow"">Twitter for iPhone</a>",Say hello to Moofasa. He must be a powerful dog. Fenced in for your protection. Just got his ear pierced. 6/10 https://t.co/w6fRfQ3RXD,Moofasa,,0.6,3016,1122,1122,3016,7418669
6.80609E+17,2015-12-26 04:41:15+00:00,"<a href=""http://twitter.com/download/iphone"" rel=""nofollow"">Twitter for iPhone</a>",This is Brody. That is his chair. He loves his chair. Never leaves it. 9/10 might be stuck actually https://t.co/WvJRg0XJit,Brody,,0.9,2780,770,770,2780,7418669
6.80584E+17,2015-12-26 03:00:19+00:00,"<a href=""http://twitter.com/download/iphone"" rel=""nofollow"">Twitter for iPhone</a>",This is Penny. Her tennis ball slowly rolled down her cone and into the pool. 8/10 bad things happen to good puppers https://t.co/YNWU7LeFgg,Penny,,0.8,3820,1447,1447,3820,7418669
6.80498E+17,2015-12-25 21:18:05+00:00,"<a href=""http://twitter.com/download/iphone"" rel=""nofollow"">Twitter for iPhone</a>",Meet Percy. He's a Latvian Yuletide Heineken. Refuses to take off sweater. Kinda feisty. 12/10 would keep in pocket https://t.co/QGM5Fcuv7s,Percy,,1.2,4463,2058,2058,4463,7418669
6.80473E+17,2015-12-25 19:39:43+00:00,"<a href=""http://twitter.com/download/iphone"" rel=""nofollow"">Twitter for iPhone</a>","This is Hector. He thinks he's a hammer. Silly Hector. You're a pupper, not a hammer. 10/10 https://t.co/OdUFuZIXiI",Hector,pupper,1,2683,803,803,2683,7418669
6.80221E+17,2015-12-25 03:00:14+00:00,"<a href=""http://twitter.com/download/iphone"" rel=""nofollow"">Twitter for iPhone</a>",This is CeCe. She's patiently waiting for Santa. 10/10 https://t.co/ZJUypFFwvg,Cece,,1,1530,309,309,1530,7418669
6.80207E+17,2015-12-25 02:01:30+00:00,"<a href=""http://twitter.com/download/iphone"" rel=""nofollow"">Twitter for iPhone</a>",I hope everyone enjoys this picture as much as I do. This is Toby. 12/10 https://t.co/vHnu1g9EJm,Toby,,1.2,2986,1263,1263,2986,7418669
6.80161E+17,2015-12-24 23:00:17+00:00,"<a href=""http://twitter.com/download/iphone"" rel=""nofollow"">Twitter for iPhone</a>",Meet Goliath. He's an example of irony. Head is phenomenally round. Wants to be an ornament. 12/10 would hug gently https://t.co/72Dil0Aktw,Goliath,,1.2,2439,789,789,2439,7418670
6.80146E+17,2015-12-24 22:00:10+00:00,"<a href=""http://twitter.com/download/iphone"" rel=""nofollow"">Twitter for iPhone</a>",Say hello to Kawhi. He was doing fine until his hat fell off. He got it back though. 10/10 deep breaths pupper https://t.co/N5pM6WBx7e,Kawhi,pupper,1,3809,1874,1874,3809,7418670
6.80131E+17,2015-12-24 21:00:12+00:00,"<a href=""http://twitter.com/download/iphone"" rel=""nofollow"">Twitter for iPhone</a>",This is Reggie. His Santa hat is a little big. 10/10 he's still having fun https://t.co/w0dcGXq7qK,Reggie,,1,2413,1021,1021,2413,7418670
6.80116E+17,2015-12-24 20:00:22+00:00,"<a href=""http://twitter.com/download/iphone"" rel=""nofollow"">Twitter for iPhone</a>",This is Ozzy. He woke up 2 minutes before he had to be ready for the Christmas party. 9/10 classic Ozzy https://t.co/Kt9vmw0Fap,Ozzy,,0.9,2861,974,974,2861,7418670
6.80086E+17,2015-12-24 18:00:19+00:00,"<a href=""https://about.twitter.com/products/tweetdeck"" rel=""nofollow"">TweetDeck</a>",This is by far the most coordinated series of pictures I was sent. Downright impressive in every way. 12/10 for all https://t.co/etzLo3sdZE,By,,1.2,13469,9579,9579,13469,7418670
6.80071E+17,2015-12-24 17:00:27+00:00,"<a href=""https://about.twitter.com/products/tweetdeck"" rel=""nofollow"">TweetDeck</a>",Say hello to Emmie. She's trapped in an ornament. Tragic af. Looks pretty content tho. Maybe it's meant to be. 9/10 https://t.co/Fh7geodBCU,Emmie,,0.9,2710,942,942,2710,7418670
6.80055E+17,2015-12-24 16:00:30+00:00,"<a href=""https://about.twitter.com/products/tweetdeck"" rel=""nofollow"">TweetDeck</a>","Meet Sammy. At first I was like ""that's a snowflake. we only rate dogs,"" but he would've melted by now, so 10/10 https://t.co/MQfPK4zwuh",Sammy,,1,17581,7648,7648,17581,7418670
6.79877E+17,2015-12-24 04:11:37+00:00,"<a href=""http://twitter.com/download/iphone"" rel=""nofollow"">Twitter for iPhone</a>",Meet Penelope. She's a bacon frise. Total babe (lol get it like the movie). Doesn't bark tho. 5/10 very average dog https://t.co/SDcQYg0HSZ,Penelope,,0.5,2071,691,691,2071,7418670
6.79873E+17,2015-12-24 03:55:21+00:00,"<a href=""http://vine.co"" rel=""nofollow"">Vine - Make a Scene</a>",This is Rocco. He's in a very intense game of freeze tag. Currently waiting to be unfrozen 10/10 https://t.co/xZXUKVXJ7l,Rocco,,1,2293,713,713,2293,7418670
6.79855E+17,2015-12-24 02:42:51+00:00,"<a href=""http://twitter.com/download/iphone"" rel=""nofollow"">Twitter for iPhone</a>",This is Bruce. He's a rare pup. Covered in Frosted Flakes. Nifty gold teeth. Overall good dog. 7/10 would pet firmly https://t.co/RtxxACzZ8A,Bruce,,0.7,3021,1326,1326,3021,7420788
6.79844E+17,2015-12-24 02:02:12+00:00,"<a href=""http://twitter.com/download/iphone"" rel=""nofollow"">Twitter for iPhone</a>",This is Willie. He's floating away and needs your assistance. Please someone help Willie. 10/10 https://t.co/MJqygWqt8X,Willie,,1,2496,825,825,2496,7418671
6.79778E+17,2015-12-23 21:37:40+00:00,"<a href=""http://twitter.com/download/iphone"" rel=""nofollow"">Twitter for iPhone</a>",This is Rinna. She's melting. 10/10 get inside pupper https://t.co/PA0czwucsb,Rinna,pupper,1,3242,1200,1200,3242,7418671
6.7973E+17,2015-12-23 18:25:38+00:00,"<a href=""http://twitter.com/download/iphone"" rel=""nofollow"">Twitter for iPhone</a>",This is Hunter. He was playing with his ball minding his own business. Has no idea what happened to the carpet. 8/10 https://t.co/DbUTDI3u1R,Hunter,,0.8,2278,883,883,2278,7418671
6.79722E+17,2015-12-23 17:55:32+00:00,"<a href=""http://twitter.com/download/iphone"" rel=""nofollow"">Twitter for iPhone</a>",This is Mike. He is a Jordanian Frito Pilates. Frowning because he can't see directly in front of him. 8/10 https://t.co/NL5QJwdEpF,Mike,,0.8,1741,504,504,1741,7418671
6.79511E+17,2015-12-23 03:58:25+00:00,"<a href=""http://twitter.com/download/iphone"" rel=""nofollow"">Twitter for iPhone</a>",Say hello to William. He makes fun of others because he's terrified of his own deep-seated insecurities. 7/10 https://t.co/bwuV6FlRxr,William,,0.7,3546,1370,1370,3546,7418671
6.79503E+17,2015-12-23 03:26:43+00:00,"<a href=""http://twitter.com/download/iphone"" rel=""nofollow"">Twitter for iPhone</a>",This is Dwight. He's a pointy pupper. Very docile. Attracts marshmallows. Hurts to pet but definitely worth it 8/10 https://t.co/jjW7zTxY9Z,Dwight,pupper,0.8,3317,1593,1593,3317,7418671
6.79476E+17,2015-12-23 01:37:45+00:00,"<a href=""http://twitter.com/download/iphone"" rel=""nofollow"">Twitter for iPhone</a>",This is Evy. She doesn't want to be a Koala. 9/10 https://t.co/VITeF0Kl9L,Evy,,0.9,2206,686,686,2206,7418671
6.79463E+17,2015-12-23 00:45:35+00:00,"<a href=""http://twitter.com/download/iphone"" rel=""nofollow"">Twitter for iPhone</a>",Meet Hurley. He's the curly one. He hugs every other dog he sees during his walk. 11/10 for spreading the love https://t.co/M6vqkt2GKV,Hurley,,1.1,33390,20248,20248,33390,7418671
6.79158E+17,2015-12-22 04:35:49+00:00,"<a href=""http://twitter.com/download/iphone"" rel=""nofollow"">Twitter for iPhone</a>",This is Rubio. He has too much skin. 11/10 https://t.co/NLOHmlENag,Rubio,,1.1,22585,8709,8709,22585,7418672
6.79132E+17,2015-12-22 02:52:45+00:00,"<a href=""http://twitter.com/download/iphone"" rel=""nofollow"">Twitter for iPhone</a>",This is Louis. He's a river dancer. His friends think it's badass. All are very supportive. 10/10 for Louis https://t.co/qoIvjKMY58,Louis,,1,3113,1240,1240,3113,7418672
6.79111E+17,2015-12-22 01:28:25+00:00,"<a href=""http://twitter.com/download/iphone"" rel=""nofollow"">Twitter for iPhone</a>",This is officially the greatest yawn of all time. 12/10 https://t.co/4R0Cc0sLVE,Officially,,1.2,6250,2739,2739,6250,7418672
6.79063E+17,2015-12-21 22:15:18+00:00,"<a href=""http://twitter.com/download/iphone"" rel=""nofollow"">Twitter for iPhone</a>",This is Chompsky. He lives up to his name. 11/10 https://t.co/Xl37lQEWd0,Chompsky,,1.1,17941,8810,8810,17941,7418672
6.79001E+17,2015-12-21 18:10:50+00:00,"<a href=""http://vine.co"" rel=""nofollow"">Vine - Make a Scene</a>",This is Rascal. He's paddling an imaginary canoe. 11/10 https://t.co/Ajquq6oGSg,Rascal,,1.1,2964,1323,1323,2964,7418672
6.78969E+17,2015-12-21 16:04:13+00:00,"<a href=""http://twitter.com/download/iphone"" rel=""nofollow"">Twitter for iPhone</a>",Meet Lola. She's a Metamorphic Chartreuse. Plays with her food. Insubordinate and churlish. Exquisite hardwood 11/10 https://t.co/etpBNXwN7f,Lola,,1.1,1720,497,497,1720,7418673
6.78798E+17,2015-12-21 04:44:55+00:00,"<a href=""http://twitter.com/download/iphone"" rel=""nofollow"">Twitter for iPhone</a>",This is Linda. She fucking hates trees. 7/10 https://t.co/blaY85FIxR,Linda,,0.7,3657,1274,1274,3657,7418673
6.78775E+17,2015-12-21 03:12:08+00:00,"<a href=""http://twitter.com/download/iphone"" rel=""nofollow"">Twitter for iPhone</a>",This is Tug. He's not required to wear the cone he just wants his voice to project more clearly. 11/10 https://t.co/Sp739Ou2qx,Tug,,1.1,2932,990,990,2932,7418673
6.78767E+17,2015-12-21 02:41:11+00:00,"<a href=""http://twitter.com/download/iphone"" rel=""nofollow"">Twitter for iPhone</a>",This is Mia. She makes awful decisions. 8/10 https://t.co/G6TQVgTcZz,Mia,,0.8,3704,1466,1466,3704,7418673
6.78765E+17,2015-12-21 02:30:45+00:00,"<a href=""http://twitter.com/download/iphone"" rel=""nofollow"">Twitter for iPhone</a>","Meet Wilson. He got caught humping the futon. He's like ""dude, help me out here"" 10/10 I'd help Wilson out https://t.co/m6XoclB0qv",Wilson,,1,1713,510,510,1713,7418673
6.78755E+17,2015-12-21 01:53:54+00:00,"<a href=""http://twitter.com/download/iphone"" rel=""nofollow"">Twitter for iPhone</a>",This is Dash. He didn't think the water would be that cold. Damn it Dash it's December. Think a little. 10/10 https://t.co/NqcOwG8pxW,Dash,,1,7498,3545,3545,7498,7418673
6.7874E+17,2015-12-21 00:53:29+00:00,"<a href=""http://twitter.com/download/iphone"" rel=""nofollow"">Twitter for iPhone</a>",Meet Tango. He's a large dog. Doesn't care much for personal space. Owner isn't very accepting. Tongue slip. 6/10 https://t.co/p2T5kGebxe,Tango,,0.6,3940,1824,1824,3940,7418673
6.78643E+17,2015-12-20 18:29:43+00:00,"<a href=""http://twitter.com/download/iphone"" rel=""nofollow"">Twitter for iPhone</a>",Meet Grizz. He just arrived. Couldn't wait until Christmas. Worried bc he saw the swastikas on the carpet. 10/10 https://t.co/QBGwYrT7rv,Grizz,,1,2148,457,457,2148,7418673
6.78424E+17,2015-12-20 03:58:55+00:00,"<a href=""http://twitter.com/download/iphone"" rel=""nofollow"">Twitter for iPhone</a>",This is Crystal. She's a shitty fireman. No sense of urgency. People could be dying Crystal. 2/10 just irresponsible https://t.co/rtMtjSl9pz,Crystal,,0.2,5670,2723,2723,5670,7418673
6.7841E+17,2015-12-20 03:02:53+00:00,"<a href=""http://twitter.com/download/iphone"" rel=""nofollow"">Twitter for iPhone</a>",Say hello to Jerome. He can shoot french fries out of his mouth at insane speeds. Deadly af. 10/10 https://t.co/dIy88HwrX8,Jerome,,1,4437,1954,1954,4437,7418673
6.78389E+17,2015-12-20 01:38:42+00:00,"<a href=""http://twitter.com/download/iphone"" rel=""nofollow"">Twitter for iPhone</a>","This is Bella. She just learned that her final grade in chem was a 92.49 
poor pupper 11/10 https://t.co/auOoKuoveM",Bella,pupper,1.1,1958,452,452,1958,7418673
6.7838E+17,2015-12-20 01:03:46+00:00,"<a href=""http://twitter.com/download/iphone"" rel=""nofollow"">Twitter for iPhone</a>",This is Crumpet. He underestimated the snow. Quickly retreating. 10/10 https://t.co/a0Zx5LDFZa,Crumpet,,1,2556,969,969,2556,7418675
6.78334E+17,2015-12-19 22:02:01+00:00,"<a href=""http://twitter.com/download/iphone"" rel=""nofollow"">Twitter for iPhone</a>",This is Rosie. She has a snazzy bow tie and a fin for a tail. Probably super fast underwater. Cool socks 10/10 https://t.co/GO76MdGBs0,Rosie,,1,1363,282,282,1363,7418675
6.78255E+17,2015-12-19 16:47:58+00:00,"<a href=""http://twitter.com/download/iphone"" rel=""nofollow"">Twitter for iPhone</a>",This is Jessifer. She is a Bismoth Teriyaki. Flowers being attacked by hurricanes on bandana (rad). 9/10 stellar pup https://t.co/nZhmRwZzWv,Jessifer,,0.9,1658,398,398,1658,7418675
6.78021E+17,2015-12-19 01:16:45+00:00,"<a href=""http://twitter.com/download/iphone"" rel=""nofollow"">Twitter for iPhone</a>",This is Reese. He likes holding hands. 12/10 https://t.co/cbLroGCbmh,Reese,,1.2,14400,6807,6807,14400,7418676
6.77962E+17,2015-12-18 21:20:32+00:00,"<a href=""http://vine.co"" rel=""nofollow"">Vine - Make a Scene</a>",This is Izzy. She's showing off the dance moves she's been working on. 11/10 I guess hard work pays off https://t.co/4JS92YAxTi,Izzy,,1.1,3574,1799,1799,3574,7418676
6.777E+17,2015-12-18 04:00:46+00:00,"<a href=""http://twitter.com/download/iphone"" rel=""nofollow"">Twitter for iPhone</a>",This is Ralph. He's an interpretive dancer. 10/10 https://t.co/zoDdPyPFsa,Ralph,,1,3554,1540,1540,3554,7418677
6.77698E+17,2015-12-18 03:54:25+00:00,"<a href=""http://twitter.com/download/iphone"" rel=""nofollow"">Twitter for iPhone</a>",This is Sadie. She got her holidays confused. 9/10 damn it Sadie https://t.co/fm7HxOsuPK,Sadie,,0.9,1283,340,340,1283,7418677
6.77574E+17,2015-12-17 19:39:03+00:00,"<a href=""http://twitter.com/download/iphone"" rel=""nofollow"">Twitter for iPhone</a>",This is Sandy. He's sexually confused. Thinks he's a pigeon. Also an All-American cheese catcher. 10/10 so petable https://t.co/Htu8plSqEu,Sandy,,1,2238,772,772,2238,7418677
6.7753E+17,2015-12-17 16:45:31+00:00,"<a href=""http://twitter.com/download/iphone"" rel=""nofollow"">Twitter for iPhone</a>",Say hello to Axel. He's a Black Chevy Pinot on wheels. 0 to 60 in 5.7 seconds (if downhill). 9/10 I call shotgun https://t.co/DKe9DBnnHE,Axel,,0.9,1122,242,242,1122,7418678
6.77332E+17,2015-12-17 03:36:28+00:00,"<a href=""http://twitter.com/download/iphone"" rel=""nofollow"">Twitter for iPhone</a>",Meet Humphrey. He's a Northern Polyp Viagra. One ear works. Face stuck like that. Always surprised. 9/10 petable af https://t.co/FS7eJQM2F4,Humphrey,,0.9,1141,253,253,1141,7418678
6.77329E+17,2015-12-17 03:26:04+00:00,"<a href=""http://twitter.com/download/iphone"" rel=""nofollow"">Twitter for iPhone</a>",This is Derek. All the dogs adore Derek. He's a great guy. 10/10 really solid pup https://t.co/KgcsGNb61s,Derek,,1,3793,1594,1594,3793,7418678
6.77315E+17,2015-12-17 02:30:09+00:00,"<a href=""http://twitter.com/download/iphone"" rel=""nofollow"">Twitter for iPhone</a>","Meet Tassy &amp; Bee. Tassy is pretty chill, but Bee is convinced the Ruffles are haunted. 10/10 &amp; 11/10 respectively https://t.co/fgORpmTN9C",Tassy,,1,1719,572,572,1719,7418678
6.77301E+17,2015-12-17 01:35:24+00:00,"<a href=""http://twitter.com/download/iphone"" rel=""nofollow"">Twitter for iPhone</a>",This is Juckson. He's totally on his way to a nascar race. 5/10 for Juckson https://t.co/IoLRvF0Kak,Juckson,,0.5,1299,437,437,1299,7418678
6.77269E+17,2015-12-16 23:29:14+00:00,"<a href=""http://twitter.com/download/iphone"" rel=""nofollow"">Twitter for iPhone</a>",This is the happiest pupper I've ever seen. 10/10 would trade lives with https://t.co/ep8ATEJwRb,The,pupper,1,2085,751,751,2085,7418678
6.77229E+17,2015-12-16 20:48:40+00:00,"<a href=""http://twitter.com/download/iphone"" rel=""nofollow"">Twitter for iPhone</a>",Say hello to Chuq. He just wants to fit in. 11/10 https://t.co/hGkMCjZzn4,Chuq,,1.1,3700,1742,1742,3700,7418679
6.76976E+17,2015-12-16 04:01:59+00:00,"<a href=""http://twitter.com/download/iphone"" rel=""nofollow"">Twitter for iPhone</a>",This is Cooper. He doesn't know how cheese works. Likes the way it feels on his face. Cheeky tongue slip. 11/10 https://t.co/j1zczS0lI5,Cooper,,1.1,2896,1139,1139,2896,7418683
6.7695E+17,2015-12-16 02:19:04+00:00,"<a href=""http://twitter.com/download/iphone"" rel=""nofollow"">Twitter for iPhone</a>",This is Tyrus. He's a Speckled Centennial Ticonderoga. Terrified of floating red ball. Nifty bandana. 8/10 v petable https://t.co/HqM3YhCaaa,Tyrus,,0.8,1359,422,422,1359,7418683
6.76948E+17,2015-12-16 02:13:31+00:00,"<a href=""http://twitter.com/download/iphone"" rel=""nofollow"">Twitter for iPhone</a>",This is Karl. Karl thinks he's slick. 6/10 sneaky pup https://t.co/Lo4ALwjVh4,Karl,,0.6,2271,927,927,2271,7418683
6.76865E+17,2015-12-15 20:40:47+00:00,"<a href=""http://twitter.com/download/iphone"" rel=""nofollow"">Twitter for iPhone</a>",Meet Ash. He's just a head now. Lost his body during the Third Crusade. Still in good spirits. 10/10 would pet well https://t.co/NJj2uP0atK,Ash,,1,2202,758,758,2202,7418683
6.76812E+17,2015-12-15 17:11:09+00:00,"<a href=""http://twitter.com/download/iphone"" rel=""nofollow"">Twitter for iPhone</a>",Say hello to Penny &amp; Gizmo. They are practicing their caroling. The ambition in the room is tangible. 9/10 for both https://t.co/aqBHjjh5VD,Penny,,0.9,1475,450,450,1475,7418684
6.76614E+17,2015-12-15 04:05:01+00:00,"<a href=""http://twitter.com/download/iphone"" rel=""nofollow"">Twitter for iPhone</a>",This is the saddest/sweetest/best picture I've been sent. 12/10 ðŸ˜¢ðŸ¶ https://t.co/vQ2Lw1BLBF,The,,1.2,1140,207,207,1140,7418685
6.76603E+17,2015-12-15 03:23:14+00:00,"<a href=""http://twitter.com/download/iphone"" rel=""nofollow"">Twitter for iPhone</a>",This is Godzilla pupper. He had a ruff childhood &amp; now deflects that pain outward by terrorizing cities. Tragic 9/10 https://t.co/g1tLGkyaxr,Godzilla,pupper,0.9,1222,414,414,1222,7418685
6.76588E+17,2015-12-15 02:23:26+00:00,"<a href=""http://twitter.com/download/iphone"" rel=""nofollow"">Twitter for iPhone</a>",This is Bubbles. He kinda resembles a fish. Always makes eye contact with u no matter what. Sneaky tongue slip. 5/10 https://t.co/Nrhvc5tLFT,Bubbles,,0.5,2437,847,847,2437,7418685
6.76583E+17,2015-12-15 02:02:01+00:00,"<a href=""http://twitter.com/download/iphone"" rel=""nofollow"">Twitter for iPhone</a>","Meet Vinnie. He's having fun while being safe. Well not a lot of fun, but definitely safe, and that's important 8/10 https://t.co/vZYtynZZlH",Vinnie,,0.8,1258,298,298,1258,7418685
6.76496E+17,2015-12-14 20:17:59+00:00,"<a href=""http://twitter.com/download/iphone"" rel=""nofollow"">Twitter for iPhone</a>",Say hello to Griffin. He's upset because his costume for Halloween didn't arrive until today. 9/10 cheer up pup https://t.co/eoBCjSFajX,Griffin,,0.9,1582,567,567,1582,7418685
6.76431E+17,2015-12-14 15:57:56+00:00,"<a href=""http://twitter.com/download/iphone"" rel=""nofollow"">Twitter for iPhone</a>","Meet Duke. He's an Urban Parmesan. They know he's scared of the green rubber dog. ""Why u do dis?"" thinks Duke. 10/10 https://t.co/3bim9U5Idr",Duke,,1,1457,365,365,1457,7418685
6.76237E+17,2015-12-14 03:08:46+00:00,"<a href=""http://twitter.com/download/iphone"" rel=""nofollow"">Twitter for iPhone</a>",Say hello to Winston. He has no respect for the system. Much rebellion. I think that's a palm tree... nice. 8/10 https://t.co/dOLQddhXLZ,Winston,,0.8,1275,312,312,1275,7418685
6.7622E+17,2015-12-14 01:58:31+00:00,"<a href=""http://twitter.com/download/iphone"" rel=""nofollow"">Twitter for iPhone</a>",This is Kenneth. He's stuck in a bubble. 10/10 hang in there Kenneth https://t.co/uQt37xlYMJ,Kenneth,,1,77874,32895,32895,77874,7418685
6.76216E+17,2015-12-14 01:43:35+00:00,"<a href=""http://twitter.com/download/iphone"" rel=""nofollow"">Twitter for iPhone</a>",This is Herm. He just wants to be like the other dogs. Sneaky tongue slip. Super fuzzy. 9/10 would cuddle firmly https://t.co/tg8h9lzCHv,Herm,,0.9,1808,622,622,1808,7418685
6.76146E+17,2015-12-13 21:07:04+00:00,"<a href=""http://twitter.com/download/iphone"" rel=""nofollow"">Twitter for iPhone</a>",This is Bert. He likes flowers. 10/10 https://t.co/lmQRrNxaQu,Bert,,1,1994,708,708,1994,7418686
